Pre Seed Round - THE MOST,https://www.crunchbase.com/funding_round/the-most-pre-seed--2fcbfac2,Pre-Seed,1070000,USD,1070000,2023-05-04,3,4,"THE MOST is revolutionizing the way women with textured hair manage and care for their tresses. We make styling fast, easy, and convenient.","3D Printing, Consumer Goods, E-Commerce, Electronics, Fashion, Health Care, Lifestyle, Manufacturing","Washington, District of Columbia, United States, North America",$1M to $10M,https://www.themostcurls.com/,THE MOST,https://www.crunchbase.com/organization/the-most,"Black Star Fund, Revitalize Venture Studio, Techstars"
Seed Round - Melodie Music,https://www.crunchbase.com/funding_round/melodie-music-seed--7335c39e,Seed,1000000,AUD,661485,2023-04-28,2,4,Music for Storytellers,"Digital Entertainment, Digital Media, Media and Entertainment, Music, Music Label, Music Streaming","Glebe, New South Wales, Australia, Oceania",$1M to $10M,https://melod.ie/,Melodie Music,https://www.crunchbase.com/organization/melodie-music,"Nick Menere, Peter Strain"
Seed Round - Nurse Disrupted,https://www.crunchbase.com/funding_round/nurse-disrupted-seed--3b98050d,Seed,1500000,USD,1500000,2023-04-25,,2,Nurse Disrupted solves complex health problems through simple solutions.,"Health Care, Medical","Fitchburg, Wisconsin, United States, North America",,https://www.nursedisrupted.com/,Nurse Disrupted,https://www.crunchbase.com/organization/nurse-disrupted,
Seed Round - EDX Medical Group,https://www.crunchbase.com/funding_round/edx-medical-group-seed--1942f729,Seed,1725000,GBP,2151307,2023-04-26,3,1,EDX Medical Group provides innovative digital diagnostic products and services.,"Health Care, Medical, Medical Device","Cambridge, Cambridgeshire, United Kingdom, Europe",,https://edxmedical.co.uk,EDX Medical Group,https://www.crunchbase.com/organization/edx-medical-group,"Bridgemere, Paul Thandi, Robert Marshall"
Seed Round - Wuyue Hangke,https://www.crunchbase.com/funding_round/wuyue-hangke-seed--5e35bb5e,Seed,,,,2023-04-25,2,1,Wuyue Hangke is specialized in production of aviation parts.,"Aerospace, Manufacturing","Suzhou, Jiangsu, China, Asia",,,Wuyue Hangke,https://www.crunchbase.com/organization/wuyue-hangke,"Jiaxing Zhaoang, Rising Investments"
Seed Round - NKure Therapeutics,https://www.crunchbase.com/funding_round/nkure-therapeutics-seed--d33090af,Seed,,,,2023-04-26,3,1,NKure Therapeutics develops NK therapy methods for cancer patients by utilising research and scientific techniques,"Biotechnology, Health Care, Therapeutics","Bangalore, Karnataka, India, Asia",,https://www.nkure.com/,NKure Therapeutics,https://www.crunchbase.com/organization/nkure-therapeutics,"Endiya Partners, Featherlite, Kotak Investment Advisors"
Pre Seed Round - Midient,https://www.crunchbase.com/funding_round/midient-pre-seed--6b39f0f4,Pre-Seed,125000,USD,125000,2023-04-28,1,1,Midient provides a game-based coupon platform for businesses for higher quality customer attention and conversion.,"Casual Games, Coupons","Erbil, Arbil, Iraq, Asia",,https://midient.space,Midient,https://www.crunchbase.com/organization/midient,Flat6Labs
Seed Round - Chemix,https://www.crunchbase.com/funding_round/chemix-92ab-seed--14a57d85,Seed,10000000,USD,10000000,2023-05-02,3,2,Chemix is using its AI-based MIX platform to develop breakthrough EV batteries.,,"Sunnyvale, California, United States, North America",,http://www.chemix.ai/,Chemix,https://www.crunchbase.com/organization/chemix-92ab,"Ibex Investors, Mayfield Fund, Radical Ventures"
Seed Round - Interactive Cares,https://www.crunchbase.com/funding_round/interactive-cares-seed--857eed73,Seed,220000,USD,220000,2023-05-02,3,2,Interactive Cares is a one stop virtual Edtech Platform for creating employability.,"EdTech, Education, Higher Education, Skill Assessment","Dhaka, Dhaka, Bangladesh, Asia",,https://interactivecares-courses.com/,Interactive Cares,https://www.crunchbase.com/organization/interactive-cares,"Blue Aura Ventures, Flagship Ventures, Mohammad Maaz"
Seed Round - AllPeep,https://www.crunchbase.com/funding_round/allpeep-seed--928160a5,Seed,,,,2023-05-12,1,1,AllPeep is a white-label social network solution that enables marketers by giving them ownership of their online community data.,"Social Network, Web Development",,,https://allpeep.com,AllPeep,https://www.crunchbase.com/organization/allpeep,HBCU Founders Accelerator
Seed Round - BE$TOW app,https://www.crunchbase.com/funding_round/bestow-payments-seed--17cc2e3b,Seed,,,,2023-05-12,1,2,Bestow Payments is a patented P2P mobile application that allows anonymous payments and contact sharing with a tap.,"Mobile Apps, Mobile Payments, Peer to Peer","Los Angeles, California, United States, North America",$1M to $10M,https://www.bestowpayments.com,BE$TOW app,https://www.crunchbase.com/organization/bestow-payments,HBCU Founders Accelerator
Seed Round - Enrich.ly,https://www.crunchbase.com/funding_round/enrich-ly-seed--202b2b0e,Seed,,,,2023-05-12,1,3,Enrich.ly Youth Enrichments provides virtual and in-person youth development.,E-Learning,"Houston, Texas, United States, North America",,https://www.enrich.ly,Enrich.ly,https://www.crunchbase.com/organization/enrich-ly,HBCU Founders Accelerator
Seed Round - Transition,https://www.crunchbase.com/funding_round/transition-seed--db1f8cf7,Seed,,,,2023-05-12,1,4,Transition connects CNA schools and healthcare employers to career outcomes.,Health Care,"Lawrenceville, Georgia, United States, North America",,https://jointransition.com,Transition,https://www.crunchbase.com/organization/transition,HBCU Founders Accelerator
Seed Round - Guilde,https://www.crunchbase.com/funding_round/guilde-seed--576a09a3,Seed,,,,2023-05-12,1,2,Guilde provides up-front pricing and licensed contractors for home renovation projects.,"Home Renovation, Marketplace, Online Portals, Small and Medium Businesses","Detroit, Michigan, United States, North America",,https://tryguilde.com,Guilde,https://www.crunchbase.com/organization/guilde,HBCU Founders Accelerator
Seed Round - SoleSafe,https://www.crunchbase.com/funding_round/solesafe-seed--4f8f86d2,Seed,,,,2023-05-12,1,2,SoleSafe delivers an automated underwriting solution specifically designed for sneakers.,"Insurance, InsurTech, Wearables","South Saint Paul, Minnesota, United States, North America",,https://www.solesafe.co,SoleSafe,https://www.crunchbase.com/organization/solesafe,HBCU Founders Accelerator
Seed Round - PayHalal,https://www.crunchbase.com/funding_round/payhalal-seed--be3edb6c,Seed,4500000,USD,4500000,2023-04-28,4,1,PayHalal is an Islamic Fintech that operates in the internet payments gateway and ewallet issuance market.,"E-Commerce, FinTech","Kuala Lumpur, Kuala Lumpur, Malaysia, Asia",,https://payhalal.com.my,PayHalal,https://www.crunchbase.com/organization/payhalal,"Asad Capital, Crescent Capital, Effective Shields, Q Cap"
Seed Round - Whale,https://www.crunchbase.com/funding_round/whale-f21e-seed--7bd6371b,Seed,2500000,USD,2500000,2023-04-25,,2,Whale is the simple knowledge sharing and training platform for SME's,"Information Technology, SaaS, Training","Ronse, Oost-Vlaanderen, Belgium, Europe",,https://www.usewhale.io,Whale,https://www.crunchbase.com/organization/whale-f21e,
Pre Seed Round - Maternify,https://www.crunchbase.com/funding_round/maternify-pre-seed--819abd2c,Pre-Seed,460000,EUR,504995,2023-04-25,3,1,Maternify is a healthcare service for home and online pregnancy and postpartum accompaniment.,"Health Care, Hospital","Madrid, Madrid, Spain, Europe",,https://www.maternify.io/,Maternify,https://www.crunchbase.com/organization/maternify,"Alejandro Castillejo Martínez, Juan Abarca Cidon, Kike Corral"
Seed Round - Soolutions,https://www.crunchbase.com/funding_round/soolutions-seed--70f0902d,Seed,2000000,EUR,2182429,2023-05-11,1,2,Soolutions is an online platform that provides EV charging equipment for homeowners and EV drivers.,"Customer Service, Electric Vehicle, Online Portals","Amsterdam, Noord-Holland, The Netherlands, Europe",,https://www.soolutions.company/,Soolutions,https://www.crunchbase.com/organization/soolutions,SeedBlink
Seed Round - Gradify,https://www.crunchbase.com/funding_round/gradify-seed--f5f9821b,Seed,,,,2023-05-11,1,1,Gradify college & career readiness technology designed for the Gen Z family.,"Career Planning, Information Technology","Charlotte, North Carolina, United States, North America",,https://app.gradify.io/,Gradify,https://www.crunchbase.com/organization/gradify,HBCU Founders Accelerator
Seed Round - Seeri,https://www.crunchbase.com/funding_round/seeri-seed--561e1c62,Seed,2700000,USD,2700000,2023-05-05,2,2,"Revolutionizing B2B buying/selling, our marketplace offers financing for streamlined transactions.Empowering for success.","B2B, E-Commerce, E-Commerce Platforms, Information Technology, Internet, Marketplace, Social Entrepreneurship, Social Impact","Bogotá, Distrito Especial, Colombia, South America",,https://www.seeri.co/,Seeri,https://www.crunchbase.com/organization/seeri,"H20 Capital Innovation, Redwood Ventures"
Seed Round - BioCam,https://www.crunchbase.com/funding_round/biocam-seed--fa5ae8db,Seed,2000000,PLN,480692,2023-05-11,1,5,BioCam is a medtech startup that increase the comfort of patients’ lives and provide new solutions for healthcare.,"Biotechnology, Health Care, Health Diagnostics, Medical, Medical Device, Software","Wroclaw, Dolnoslaskie, Poland, Europe",,https://biocam.pl/,BioCam,https://www.crunchbase.com/organization/biocam,Level2 Ventures
Seed Round - Deskree,https://www.crunchbase.com/funding_round/deskree-seed--4d5a85ce,Seed,,,,2023-05-01,6,2,Deskree is a no-code back-end for any app in under 10 minutes.,"Database, Developer APIs, Developer Tools, Information Services, Information Technology, Software","Toronto, Ontario, Canada, North America",,https://www.deskree.com,Deskree,https://www.crunchbase.com/organization/deskree,"Flair Ventures, Flyer One Ventures, LOI Venture, Vesna Capital, Vlad Magdalin, ZAKA VC"
Seed Round - Climatica,https://www.crunchbase.com/funding_round/climatica-seed--fbc38eb5,Seed,,,,2023-05-04,2,2,Climatica is the creator of a parametric insurance platform used to provide digital weather insurance.,"Insurance, InsurTech, Software","Plac, Podkarpackie, Poland, Europe",,https://www.climatica.ai,Climatica,https://www.crunchbase.com/organization/climatica,"BEYOND, Startup Wise Guys"
Seed Round - DearEmployee,https://www.crunchbase.com/funding_round/dearemployee-seed--76442653,Seed,,,,2023-04-24,4,2,Workplace Mental Health Platform,"Health Care, Human Resources, Information Technology","Berlin, Berlin, Germany, Europe",,https://www.dearemployee.de/,DearEmployee,https://www.crunchbase.com/organization/dearemployee,"Brandenburg Kapital, High-Tech Grunderfonds, Impact51, Mittelständische Beteiligungsgesellschaft Baden-Württemberg"
Seed Round - AES TECH,https://www.crunchbase.com/funding_round/aes-tech-seed--526748e9,Seed,,,,2023-05-10,1,1,AES TECH is an eco-friendly technology company for a carbon-neutral society.,"Environmental Consulting, Information Services, Information Technology","Seoul, Seoul-t'ukpyolsi, South Korea, Asia",,https://aestech.co.kr,AES TECH,https://www.crunchbase.com/organization/aes-tech,Schmidt
Seed Round - Ecoin Energy,https://www.crunchbase.com/funding_round/ecoin-energy-seed--a58a344d,Seed,,,,2023-05-10,1,1,Ecoin Energy employs chemical recycling waste plastic technology.,"Plastics and Rubber Manufacturing, Recycling, Waste Management","Daejeon, Taejon-jikhalsi, South Korea, Asia",,http://www.ecoinenergy.com,Ecoin Energy,https://www.crunchbase.com/organization/ecoin-energy,MYSC
Seed Round - Octet Scientific,https://www.crunchbase.com/funding_round/octet-scientific-seed--99f0a4c9,Seed,1000000,USD,1000000,2023-04-25,3,5,Octet Scientific addresses an unmet need for support chemistry in the Zinc Battery industry.,,"Ohio, Illinois, United States, North America",,https://www.octetsci.com/,Octet Scientific,https://www.crunchbase.com/organization/octet-scientific,"Advanced Manufacturing Fund, Jumpstart Ventures, MAGNET"
Seed Round - CurbWaste,https://www.crunchbase.com/funding_round/curbwaste-seed--5ea16712,Seed,4000000,USD,4000000,2023-04-24,3,4,CurbWaste revolutionizes the waste management ecosystem through its cloud-based and data-driven cleantech platform.,"CleanTech, Enterprise Software, SaaS, Software, Waste Management","New York, New York, United States, North America",,https://curbwaste.com,CurbWaste,https://www.crunchbase.com/organization/curbwaste,"B Capital Group, Mucker Capital, TTV Capital"
Pre Seed Round - Epicbrief,https://www.crunchbase.com/funding_round/epicbrief-pre-seed--fcf5e1f1,Pre-Seed,1000000,EUR,1105745,2023-04-24,2,1,Epicbrief joins hundreds of sales representatives on a quest to improve the significance and value of human work in sales.,"B2B, Business Development, Sales","Helsinki, Southern Finland, Finland, Europe",,https://www.epicbrief.com,Epicbrief,https://www.crunchbase.com/organization/epicbrief,"Curiosity VC, Superhero Capital"
Seed Round - Mimo Live Sales,https://www.crunchbase.com/funding_round/mimo-live-sales-seed--cd41eb1d,Seed,,,,2023-05-04,2,2,Mimo Live Sales is a Live Commerce B2B SAAS pioneer in the Latam market,"E-Commerce, Retail, SaaS","São Paulo, Sao Paulo, Brazil, South America",,https://mimo.com.br/,Mimo Live Sales,https://www.crunchbase.com/organization/mimo-live-sales,"Cencosud Ventures, LW Ventures"
Seed Round - ecoplanet,https://www.crunchbase.com/funding_round/ecoplanet-seed--4cfedf3b,Seed,2600000,EUR,2868215,2023-04-27,2,1,"ecoplanet, the B2B energy platform.","B2B, Energy","München, Bayern, Germany, Europe",,https://www.ecoplanet.tech,ecoplanet,https://www.crunchbase.com/organization/ecoplanet,"Gerhard Cromme, HV Capital"
Seed Round - Socialerus,https://www.crunchbase.com/funding_round/socialerus-seed--2537f8b3,Seed,,,,2023-05-10,1,2,Socialerus offers YouTube ranking and analysis services.,"Analytics, Information Services, Internet","Yeoksamdong, Seoul-t'ukpyolsi, South Korea, Asia",,https://socialerus.com,Socialerus,https://www.crunchbase.com/organization/socialerus,Pathfinder
Seed Round - Melius Cyber,https://www.crunchbase.com/funding_round/melius-cyber-security-seed--b849a3f8,Seed,500000,GBP,620714,2023-04-25,1,2,"Melius Cyber continuously monitors an organization's IT network, testing security and protecting it from the latest threats.","Cyber Security, Information Services, Information Technology","Wear, Devon, United Kingdom, Europe",$1M to $10M,https://meliuscyber.com/,Melius Cyber,https://www.crunchbase.com/organization/melius-cyber-security,Northeast Venture Fund ( NEVF )
Seed Round - Bolta,https://www.crunchbase.com/funding_round/bolta-seed--1fe5a202,Seed,,,,2023-05-10,1,1,Volta Corporation is a SaaS firm that prepares and manages electronic tax invoices.,"SaaS, Software","Seoul, Seoul-t'ukpyolsi, South Korea, Asia",,https://bolta.io,Bolta,https://www.crunchbase.com/organization/bolta,Spring Camp
Seed Round - Sneakers,https://www.crunchbase.com/funding_round/sneakers-seed--877ee3d2,Seed,500000000,KRW,379247,2023-05-10,1,2,Sneakers is a real-time on-demand local information platform.,"Information Services, Local, Real Time","Mapo, Seoul-t'ukpyolsi, South Korea, Asia",,https://sneakersapp.io,Sneakers,https://www.crunchbase.com/organization/sneakers,CJ Investment
Seed Round - Dermanostic,https://www.crunchbase.com/funding_round/dermanostic-seed--7aa5b5e3,Seed,,,,2023-05-09,1,3,Dermanostic is an online dermatologist app that offers dermatological treatment available to everyone.,"Apps, Health Care, Medical, Wellness","Düsseldorf, Nordrhein-Westfalen, Germany, Europe",Less than $1M,https://dermanostic.com/en,Dermanostic,https://www.crunchbase.com/organization/dermanostic,Tina Mueller
Seed Round - Zoth,https://www.crunchbase.com/funding_round/zoth-437e-seed--09ae65cc,Seed,50000,USD,50000,2023-05-09,1,2,Zoth empowering Businesses in emerging markets.,"Blockchain, Finance, Financial Services, FinTech, Lending","Sheridan, Wyoming, United States, North America",,https://zoth.io/,Zoth,https://www.crunchbase.com/organization/zoth-437e,Graviton Web3 Accelerator
Pre Seed Round - Fetcch,https://www.crunchbase.com/funding_round/fetcch-pre-seed--a07962fd,Pre-Seed,50000,USD,50000,2023-05-09,1,1,"Fetcch is a payment connectivity network that connects users, wallets, and dApps.","Computer, Payments",,,https://www.fetcch.xyz,Fetcch,https://www.crunchbase.com/organization/fetcch,Graviton Web3 Accelerator
Seed Round - Wall,https://www.crunchbase.com/funding_round/wall-4f21-seed--d3d15631,Seed,50000,USD,50000,2023-05-09,1,2,Wall.app is a platform where people can look out for the top new non-fungible token (NFT) trading.,Blockchain,"Bangalore, Karnataka, India, Asia",,https://www.wall.app/,Wall,https://www.crunchbase.com/organization/wall-4f21,Graviton Web3 Accelerator
Pre Seed Round - GETSecured,https://www.crunchbase.com/funding_round/getsecured-pre-seed--1f224612,Pre-Seed,50000,USD,50000,2023-05-09,1,1,"GETSecured is a security, risk assessment, and due diligence tool that is available to both retail and institutional investors.","Computer, Network Security","Bengaluru, Karnataka, India, Asia",,https://getsecured.ai,GETSecured,https://www.crunchbase.com/organization/getsecured,Graviton Web3 Accelerator
Pre Seed Round - Strive,https://www.crunchbase.com/funding_round/strive-0561-pre-seed--d514ef37,Pre-Seed,50000,USD,50000,2023-05-09,1,1,"Strive Is a utility protocol that allows NFTs to be monetised, rented, traded, and shared, as well as an SDK for NFT applications.","Blockchain, Education","Gurgaon, Haryana, India, Asia",,https://www.strv.network,Strive,https://www.crunchbase.com/organization/strive-0561,Graviton Web3 Accelerator
Pre Seed Round - VOX AI,https://www.crunchbase.com/funding_round/vox-0fa1-pre-seed--aa4ceaaf,Pre-Seed,250000,USD,250000,2023-04-24,,2,B2B SaaS Conversational AI startup,"B2B, Customer Service, E-Commerce, Natural Language Processing, SaaS, Virtual Assistant","Kuala Lumpur, Kuala Lumpur, Malaysia, Asia",,https://www.thevoxasia.com,VOX AI,https://www.crunchbase.com/organization/vox-0fa1,
Seed Round - BettrAds,https://www.crunchbase.com/funding_round/bettrads-seed--fce316e9,Seed,,,,2023-05-09,1,3,Ads data management optimization and performance platform,"Advertising, Artificial Intelligence, Business Intelligence, Data Integration, Marketing, Marketing Automation, Predictive Analytics, Software","São Paulo, Sao Paulo, Brazil, South America",,https://bettrads.ai,BettrAds,https://www.crunchbase.com/organization/bettrads,Startup Lisboa
Seed Round - ThePlaceToWish,https://www.crunchbase.com/funding_round/theplacetowish-seed--e62953a3,Seed,1000000,EUR,1098292,2023-05-10,1,2,ThePlaceToWish develop AI platform online gifts to offer your friendsand family.,"Gift, Gift Exchange","Saint-thiébault, Champagne-Ardenne, France, Europe",,https://www.theplacetowish.com,ThePlaceToWish,https://www.crunchbase.com/organization/theplacetowish,Luxembourg Business Angel Network (LBAN)
Pre Seed Round - Nectar,https://www.crunchbase.com/funding_round/nectar-185a-pre-seed--7b793da7,Pre-Seed,100000,USD,100000,2023-05-09,1,1,Nectar helps fleets electrify and get around insufficient grid power with our proprietary mobile batteries and software.,,"Toronto, Ontario, Canada, North America",,https://www.getnectar.io/,Nectar,https://www.crunchbase.com/organization/nectar-185a,U.S. Venture Sustainability Accelerator
Pre Seed Round - Spydra,https://www.crunchbase.com/funding_round/spydra-pre-seed--0b910d2a,Pre-Seed,3000000,USD,3000000,2023-05-09,1,1,Scalable Web 3 Service & Infrastructure Provider | Blockchain Technology Solutions for Your Business on SPYDRA.,"Banking, Blockchain, Enterprise Software, FinTech, Manufacturing, Retail, SaaS, Supply Chain Management","Austin, Texas, United States, North America",,https://www.spydra.app/,Spydra,https://www.crunchbase.com/organization/spydra,Graviton Web3 Accelerator
Seed Round - Big Akwa,https://www.crunchbase.com/funding_round/big-akwa-seed--98b49e29,Seed,1750000,SEK,170613,2023-05-03,2,3,Big Akwa is a food-tech industry expert that produces sustainable protein using industrial waste.,"Aquaculture, Food and Beverage, Food Processing","Härnösand, Vasternorrlands Lan, Sweden, Europe",,https://www.bigakwa.com/,Big Akwa,https://www.crunchbase.com/organization/big-akwa,"Almi Invest, Sparbanksstiftelse Norrlands Riskkapitalstiftelse"
Seed Round - GravityXR,https://www.crunchbase.com/funding_round/gravityxr-seed--47a74b4b,Seed,,,,2023-04-24,3,3,GravityXR is an XR chip developer and a terminal equipment manufacturer serving the XR (AR/VR/MR) field.,"Industrial Manufacturing, Information Technology, Semiconductor, Virtual Reality","Ningbo, Zhejiang, China, Asia",,https://www.gravityxr.cn/,GravityXR,https://www.crunchbase.com/organization/gravityxr,"GoerTek Inc., HoYoverse, Pico Interactive"
Seed Round - AI WORLD,https://www.crunchbase.com/funding_round/ai-world-cee8-seed--096aeec5,Seed,3000000,USD,3000000,2023-04-25,1,1,AI WORLD focusing on global projects of artificial intelligence technology innovation and blockchain application.,"Artificial Intelligence, Blockchain",,,,AI WORLD,https://www.crunchbase.com/organization/ai-world-cee8,SoftBank Capital
Seed Round - Sinecure.ai,https://www.crunchbase.com/funding_round/sinecure-ai-seed--d378bf65,Seed,2500000,USD,2500000,2023-04-27,1,2,Sinecure.ai is an enterprise SaaS platform reinventing talent acquisition and retention through the use of artificial intelligence.,"Artificial Intelligence, Human Resources, Machine Learning, Recruiting, SaaS, Software","New York, New York, United States, North America",,http://www.sinecure.ai,Sinecure.ai,https://www.crunchbase.com/organization/sinecure-ai,Golden Section
Seed Round - Abby,https://www.crunchbase.com/funding_round/abby-e13d-seed--7a61b83b,Seed,1200000,EUR,1326894,2023-04-24,3,2,Abby is a management app that helps entrepreneurs get rid of administrative tasks and improve their organization.,"Apps, SaaS, Software","Nancy, Lorraine, France, Europe",,https://abby.fr/,Abby,https://www.crunchbase.com/organization/abby-e13d,"Myrtus Venture, Tomcat Invest, Yeast"
Seed Round - Bottobo,https://www.crunchbase.com/funding_round/ottobo-seed--63819426,Seed,1000,USD,1000,2023-04-27,,2,"Bottobo creates intelligent, fully automated, and self-contained Warehouse Robots and Intelligent Systems.","Artificial Intelligence, Autonomous Vehicles, Industrial Automation, Logistics, Robotics, Supply Chain Management, Transportation, Warehousing","Istanbul, Istanbul, Turkey, Europe",,http://www.bottobo.com,Bottobo,https://www.crunchbase.com/organization/ottobo,
Seed Round - EmpreX,https://www.crunchbase.com/funding_round/emprex-seed--f2d26d27,Seed,11000000,BRL,2209856,2023-04-27,1,1,Personal Credit FinTech,FinTech,"São Paulo, Sao Paulo, Brazil, South America",,https://www.emprex.com.br/,EmpreX,https://www.crunchbase.com/organization/emprex,Jason Nassof
Pre Seed Round - ARGOS Cloud Security,https://www.crunchbase.com/funding_round/argos-cloud-security-pre-seed--e92d0ceb,Pre-Seed,100000,EUR,109705,2023-05-01,1,2,"Cloud Security and Compliance assessments for MS(S)P done in under 5 mins, including detailed diagrams so you know exactly what to focus on.","Cloud Security, Cyber Security, Information Technology, SaaS, Software","Geelong, Victoria, Australia, Oceania",,https://argos-security.io,ARGOS Cloud Security,https://www.crunchbase.com/organization/argos-cloud-security,Startup Wise Guys
Pre Seed Round - Infyos,https://www.crunchbase.com/funding_round/infyos-pre-seed--33bb6163,Pre-Seed,1000000,USD,1000000,2023-04-25,3,3,Infyos helps battery and car makers manage and improve their company and supply chains sustainability.,"Automotive, Battery, GreenTech, Software, Sustainability","London, England, United Kingdom, Europe",,https://www.infyos.com/,Infyos,https://www.crunchbase.com/organization/infyos,"Carbon13, Nucleus Capital, Pale Blue Dot"
Pre Seed Round - Natural Trace,https://www.crunchbase.com/funding_round/natural-trace-pre-seed--ee2cbae5,Pre-Seed,1050000,USD,1050000,2023-05-01,5,2,Enables companies and consumers to fully trust in the provenance and safety of all food,"Food and Beverage, Food Processing, Quality Assurance","Singapore, Central Region, Singapore, Asia",,https://natural-trace.com,Natural Trace,https://www.crunchbase.com/organization/natural-trace,"Alex Wild, Angel Investors, Blue InCube Ventures, Christian Wiegele, Markus Helms"
Seed Round - Dspace,https://www.crunchbase.com/funding_round/dspace-63df-seed--99079a9b,Seed,1000000,USD,1000000,2023-04-24,1,1,Dspace is an LBS social graph protocol platform that provides social graph protocol services based on real geographic.,"Artificial Intelligence, Blockchain, Social Media",,,https://www.d-space.io/,Dspace,https://www.crunchbase.com/organization/dspace-63df,Cypher Capital
Pre Seed Round - Aimy,https://www.crunchbase.com/funding_round/aimy-26c0-pre-seed--d08e3521,Pre-Seed,250000,EUR,275789,2023-04-27,1,1,Aimy is a software company that provides administrative work and saved labor cost services.,"Data Center, Machine Learning, SaaS, Software","Bergen, Hordaland, Norway, Europe",$1M to $10M,https://aimy.no,Aimy,https://www.crunchbase.com/organization/aimy-26c0,VNTRS
Seed Round - Panamera Holdings Corporation,https://www.crunchbase.com/funding_round/panamera-holdings-corporation-seed--8c3ce4d6,Seed,200000,USD,200000,2023-05-12,,1,"Panamera Holdings is building relationships with recycling, metals, service, and manufacturing businesses to expand operations.","Manufacturing, Precious Metals",,,,Panamera Holdings Corporation,https://www.crunchbase.com/organization/panamera-holdings-corporation,
