Seed Round - GrupoTusMaquinas,https://www.crunchbase.com/funding_round/grupotusmaquinas-seed--decf3c69,Seed,1200000,USD,1200000,2023-06-16,,2,"We're a Marketplace specialized in services for big machines: lend, sell, finance.","Construction, Marketplace, Mining","Santiago, Region Metropolitana, Chile, South America",,https://www.grupotusmaquinas.com/,GrupoTusMaquinas,https://www.crunchbase.com/organization/grupotusmaquinas
Pre Seed Round - Vasar,https://www.crunchbase.com/funding_round/vasar-pre-seed--bf0d5eb2,Pre-Seed,,,,2023-05-16,,1,B2B marketplace connecting players in the manufacturing and industrial sector.,"B2B, Manufacturing, Marketplace, Payments, Supply Chain Management",,,https://vasar.io,Vasar,https://www.crunchbase.com/organization/vasar
Pre Seed Round - Sthani,https://www.crunchbase.com/funding_round/sthani-pre-seed--f2b70c59,Pre-Seed,,,,2023-05-30,,1,E-Commerce App,E-Commerce,"Goa, Goa, India, Asia",,https://sthani.in,Sthani,https://www.crunchbase.com/organization/sthani
Pre Seed Round - ASTA,https://www.crunchbase.com/funding_round/asta-7c9a-pre-seed--e722df20,Pre-Seed,2000,USD,2000,2023-06-03,,1,An UX driven software development company.,"Consulting, E-Commerce, Information Technology, Marketing, Software, Web Development","Colombo, Western, Sri Lanka, Asia",,https://astacodelabs.com/,ASTA,https://www.crunchbase.com/organization/asta-7c9a
Pre Seed Round - Karggu,https://www.crunchbase.com/funding_round/karggu-pre-seed--a08a6ab8,Pre-Seed,,,,2023-06-01,,1,SaaS platform to digitalize the independent cargo industry in Latam.,"E-Commerce, Logistics, SaaS, Software","Puebla De Zaragoza, Puebla, Mexico, North America",,https://karggu.com,Karggu,https://www.crunchbase.com/organization/karggu
Seed Round - Hurthado,https://www.crunchbase.com/funding_round/hurthado-seed--fba0d227,Seed,,,,2023-06-02,,1,Hurthado is a Made-to-Order clothing brand. All clothes are designed and handmade on demand.,"E-Commerce, Fashion","Madrid, Madrid, Spain, Europe",,http://www.hurthado.com,Hurthado,https://www.crunchbase.com/organization/hurthado
Seed Round - TAAT,https://www.crunchbase.com/funding_round/taat-seed--6f22b574,Seed,126822,EUR,136405,2023-05-24,,1,Customized cosmetic product on the basis of multispectral analysis.,"Advertising, B2B, Consulting, E-Commerce, Health Care, Information Technology, Internet, Manufacturing, Mobile Apps, Software","Lubien Kujawski, Kujawsko-Pomorskie, Poland, Europe",,https://info508380.wixsite.com/taat,TAAT,https://www.crunchbase.com/organization/taat
Pre Seed Round - KiselPR,https://www.crunchbase.com/funding_round/kiselpr-pre-seed--26b214ed,Pre-Seed,,,,2023-05-23,,1,KiselPR marketplace. Breaking the stereotypes of the entire advertising industry.,"Advertising Platforms, Marketplace, Public Relations, Sales Automation, Social Media Advertising, Social Media Marketing","Delaware, Ohio, United States, North America",,http://kiselpr.com,KiselPR,https://www.crunchbase.com/organization/kiselpr
Pre Seed Round - Vucar,https://www.crunchbase.com/funding_round/vucar-pre-seed--a82a5d14,Pre-Seed,100000,USD,100000,2023-05-20,,3,Vucar.vn is a buyer-focused online used car consignment platform.,"Automotive, E-Commerce, E-Commerce Platforms, Marketplace","Ho Chi Minh City, NA - Vietnam, Vietnam, Asia",,https://www.vucar.vn/vi/,Vucar,https://www.crunchbase.com/organization/vucar
Pre Seed Round - Sympl Solutions,https://www.crunchbase.com/funding_round/sympl-solutions-pre-seed--dcbaf050,Pre-Seed,,,,2023-06-12,,1,SaaS Retail Management Solution,"Retail, Retail Technology, Software","Houston, Texas, United States, North America",,,Sympl Solutions,https://www.crunchbase.com/organization/sympl-solutions
Pre Seed Round - Conseguir,https://www.crunchbase.com/funding_round/conseguir-576d-pre-seed--06616f5e,Pre-Seed,10000,USD,10000,2023-05-15,,1,Marketplace Mobile App,"Artificial Intelligence, Marketplace, Mobile Apps","Medellín, Antioquia, Colombia, South America",,https://www.conseguir.co,Conseguir,https://www.crunchbase.com/organization/conseguir-576d
Pre Seed Round - Top Ingrediente Srl,https://www.crunchbase.com/funding_round/top-ingrediente-srl-pre-seed--8df85bec,Pre-Seed,1000000,USD,1000000,2023-05-15,,1,Top Ingrediente Srl is an e-commerce retail website.,E-Commerce,"Joita, Giurgiu, Romania, Europe",,https://topingrediente.com/,Top Ingrediente Srl,https://www.crunchbase.com/organization/top-ingrediente-srl
Pre Seed Round - talam.shop,https://www.crunchbase.com/funding_round/talam-shop-pre-seed--b4ae68f1,Pre-Seed,60000,USD,60000,2023-05-16,,1,talam.shop is a D2C platform based in Tamil Nadu to sell MSME products directly from manufacturers.,"E-Commerce, Online Portals","Chennai, Tamil Nadu, India, Asia",,https://talam.shop,talam.shop,https://www.crunchbase.com/organization/talam-shop
Seed Round - SOORT AG,https://www.crunchbase.com/funding_round/netandbuy-com-ag-seed--ee6fd1e1,Seed,,CHF,,2023-06-07,,3,Soort.eco uses AI to match customers with sustainable products and shops,"Artificial Intelligence, B2C, E-Commerce, E-Commerce Platforms, Green Consumer Goods, Information Technology, Mobile Advertising, Social Entrepreneurship, Sustainability","Zürich, Zurich, Switzerland, Europe",$10M to $50M,https://soort.eco,SOORT AG,https://www.crunchbase.com/organization/netandbuy-com-ag
Pre Seed Round - Smilie,https://www.crunchbase.com/funding_round/smilie-pre-seed--17adf463,Pre-Seed,200000,USD,200000,2023-06-30,,2,"Smilie offers a simple-to-use dashboard, allowing businesses to easily navigate and manage the gifting process.","Gift, SaaS, Software","Singapore, Central Region, Singapore, Asia",,https://smilie.io,Smilie,https://www.crunchbase.com/organization/smilie
Seed Round - Gowit Technology,https://www.crunchbase.com/funding_round/gowit-technology-seed--4a3c4cf7,Seed,1000000,USD,1000000,2023-06-01,4,1,Multichannel ad monetization platform for marketplaces and online retailers.,"Advertising, Advertising Platforms, Analytics, Retail Technology","Newark, Delaware, United States, North America",,https://gowit.com,Gowit Technology,https://www.crunchbase.com/organization/gowit-technology
Pre Seed Round - Octocom,https://www.crunchbase.com/funding_round/octocom-pre-seed--5ad49eae,Pre-Seed,500000,USD,500000,2023-05-15,,1,Software for e-commerce stores,"E-Commerce, Software","London, England, United Kingdom, Europe",,https://www.octocom.ai/,Octocom,https://www.crunchbase.com/organization/octocom
Pre Seed Round - Zevello,https://www.crunchbase.com/funding_round/zevello-pre-seed--709c0051,Pre-Seed,100000,USD,100000,2023-06-01,,1,"Empowering Property Seekers with Global Real Estate Market place for selling, buying or finding a tenant or a co-living partner","Marketplace, Real Estate","Bangalore City, Karnataka, India, Asia",,https://zevello.com/,Zevello,https://www.crunchbase.com/organization/zevello
Pre Seed Round - Plantex,https://www.crunchbase.com/funding_round/plantex-78da-pre-seed--72098363,Pre-Seed,1000000,MYR,216755,2023-06-01,,1,World Class Plant Based Supply Chain,"Business Development, Food and Beverage, Manufacturing, Retail, Service Industry","Ipoh, Perak, Malaysia, Asia",,https://plantex.my/,Plantex,https://www.crunchbase.com/organization/plantex-78da
Seed Round - MUAB,https://www.crunchbase.com/funding_round/muab-seed--f1a70bb6,Seed,100000,USD,100000,2023-07-01,,1,"platform, Network, communication , education","E-Commerce, Education, Software",,,https://play.google.com/store/apps/details?id=com.network.muab&hl=ar&gl=US,MUAB,https://www.crunchbase.com/organization/muab
