Seed Round - Motionworks,https://www.crunchbase.com/funding_round/5a39b549-19de-42cd-8f44-5ad02ee28876,Seed,6800000,USD,6800000,2023-04-25,,1,Motionworks takes disparate data sources and turns them into contextualized actionable insights and presents them through software.,"Location Based Services, Market Research, Outdoor Advertising, Software, Tourism","Atlanta, Georgia, United States, North America",$1M to $10M,https://www.mworks.com/,Motionworks,https://www.crunchbase.com/organization/7626c226-8533-487f-80e2-ede36d7cd11f,
Seed Round - RoddyMedical,https://www.crunchbase.com/funding_round/roddymedical-seed--25ecf055,Seed,50000,USD,50000,2023-04-25,,3,RoddyMedical develops innovative medical devices that improve clinical safety and patient outcomes.,"Health Care, Medical, Medical Device","Wauwatosa, Wisconsin, United States, North America",$1M to $10M,https://www.roddymedical.com/,RoddyMedical,https://www.crunchbase.com/organization/roddymedical,
Seed Round - Moshun,https://www.crunchbase.com/funding_round/moshun-seed--7a4d30d5,Seed,502250,USD,502250,2023-04-25,,1,Moshun is an IP house that provides technology-based motion control devices.,"Consumer, Consumer Goods, Information Technology","Oak Brook, Illinois, United States, North America",,https://www.moshun.com,Moshun,https://www.crunchbase.com/organization/moshun,
Seed Round - Wovn,https://www.crunchbase.com/funding_round/wovn-4228-seed--8e626fa1,Seed,,,,2023-05-10,1,1,Powering the web3 creator economy,,,,,Wovn,https://www.crunchbase.com/organization/wovn-4228,Outlier Ventures
Seed Round - Numbers Protocol,https://www.crunchbase.com/funding_round/numbers-protocol-205c-seed--e6ba0e86,Seed,,,,2023-05-10,1,1,An open and decentralized network designed to ensure provenance for all types of creative works created by humans & AI.,,,,,Numbers Protocol,https://www.crunchbase.com/organization/numbers-protocol-205c,Outlier Ventures
Seed Round - Nettle,https://www.crunchbase.com/funding_round/nettle-e576-seed--77fa82f1,Seed,,,,2023-05-10,1,1,Nettle is the next step in the evolution of digital pay and loyalty rewards,,,,,Nettle,https://www.crunchbase.com/organization/nettle-e576,Outlier Ventures
Seed Round - Delphi,https://www.crunchbase.com/funding_round/delphi-424c-seed--e121f7dd,Seed,6250000,USD,6250000,2023-05-01,1,1,Unleash the power of dbt with the ease of point-and-click,"Analytics, B2B, Business Intelligence, Data Integration, Enterprise Software, SaaS, Software",,,,Delphi,https://www.crunchbase.com/organization/delphi-424c,INT3
Seed Round - SPIN,https://www.crunchbase.com/funding_round/spin-4f6f-seed--bc54eaab,Seed,,,,2023-05-10,1,1,The physical-first web3 retail infrastructure and marketplace built on blockchain,,,,,SPIN,https://www.crunchbase.com/organization/spin-4f6f,Outlier Ventures
Seed Round - Rampnalysis,https://www.crunchbase.com/funding_round/rampnalysis-seed--b30b9323,Seed,,,,2023-05-08,1,1,Intelligent Fiat On/Off Ramp Aggregation and Analysis,,,,,Rampnalysis,https://www.crunchbase.com/organization/rampnalysis,Outlier Ventures
Seed Round - Me Protocol,https://www.crunchbase.com/funding_round/me-protocol-seed--f486b4f1,Seed,,,,2023-05-10,1,1,"The Me Protocol is blockchain infrastructure that enables open, frictionless loyalty rewards to be exchanged across brands.",,,,,Me Protocol,https://www.crunchbase.com/organization/me-protocol,Outlier Ventures
Seed Round - Solaire,https://www.crunchbase.com/funding_round/solaire-2d89-seed--73610bff,Seed,,,,2023-05-10,1,1,The bridge connecting the physical world and the digital world,,,,,Solaire,https://www.crunchbase.com/organization/solaire-2d89,Outlier Ventures
Seed Round - Ather Digital,https://www.crunchbase.com/funding_round/ather-digital-seed--b7307f01,Seed,12000000,USD,12000000,2023-05-01,1,1,Ather Digital,,,,,Ather Digital,https://www.crunchbase.com/organization/ather-digital,Delta Blockchain Fund
Pre Seed Round - Arcade,https://www.crunchbase.com/funding_round/arcade-f26a-pre-seed--75e7b281,Pre-Seed,,,,2023-05-01,1,8,Arcade is a software company engaging people working in distributed workplaces.,"Gamification, SaaS, Sales, Software","Plano, Texas, United States, North America",$1M to $10M,https://arcade.co,Arcade,https://www.crunchbase.com/organization/arcade-f26a,Forum Ventures
Seed Round - PakMule,https://www.crunchbase.com/funding_round/pakmule-seed--0bec705c,Seed,539460,USD,539460,2023-04-24,,1,PakMule is a manufacturer of hitch baskets intended to facilitate adventure trips.,Consumer Goods,"Houston, Texas, United States, North America",,https://pakmule.com/,PakMule,https://www.crunchbase.com/organization/pakmule,
Pre Seed Round - Alfred,https://www.crunchbase.com/funding_round/alfred-pre-seed--68d10979,Pre-Seed,,,,2023-05-05,1,9,Alfred is the largest and most advanced residential management platform.,"Home Services, Hospitality, Property Management, Real Estate, Software","New York, New York, United States, North America",$1M to $10M,http://www.helloalfred.com,Alfred,https://www.crunchbase.com/organization/alfred,FJ Labs
Seed Round - C Wire,https://www.crunchbase.com/funding_round/c-wire-seed--53852f63,Seed,,,,2023-05-11,1,3,Making every ad relevant,"Advertising, Advertising Platforms, Content Marketing, Marketing Automation, Video Advertising","Zürich, Zurich, Switzerland, Europe",,https://www.cwire.com,C Wire,https://www.crunchbase.com/organization/c-wire,Hellen's Rock Capital
Seed Round - Unaris,https://www.crunchbase.com/funding_round/unaris-seed--e8ddb313,Seed,,,,2023-05-03,1,1,Unaric buys builds and grows salesforce-based SaaS companies.,"SaaS, Software, Web Development","London, England, United Kingdom, Europe",,https://unaris.com,Unaris,https://www.crunchbase.com/organization/unaris,FJ Labs
Pre Seed Round - Numeus,https://www.crunchbase.com/funding_round/numeus-pre-seed--4605af4f,Pre-Seed,,,,2023-05-05,1,1,"Numeus offers crypto collective focusing on Research, Venture Capital, Market Making, Asset Management and Algorithmic Trading.",,"Zug, Zug, Switzerland, Europe",,,Numeus,https://www.crunchbase.com/organization/numeus,FJ Labs
Pre Seed Round - Paraplanner,https://www.crunchbase.com/funding_round/paraplanner-ad91-pre-seed--8e10b404,Pre-Seed,175000,USD,175000,2023-05-08,1,1,"Paraplanner is an AI copilot that helps automate administrative tasks, like client onboarding.","Business Development, CRM, Financial Services, Marketing Automation","Austin, Texas, United States, North America",,https://www.paraplanner.ai,Paraplanner,https://www.crunchbase.com/organization/paraplanner-ad91,Antler
Pre Seed Round - Agentio,https://www.crunchbase.com/funding_round/agentio-pre-seed--af08a8ff,Pre-Seed,50000,USD,50000,2023-05-09,1,1,Agentio,,,,,Agentio,https://www.crunchbase.com/organization/agentio,Antler
Pre Seed Round - Keystone,https://www.crunchbase.com/funding_round/keystone-5922-pre-seed--54187b42,Pre-Seed,125000,USD,125000,2023-04-28,1,1,Keystone is a data catalyst for the task force for nature-related financial disclosures.,"Artificial Intelligence, Information Technology, Life Science, Supply Chain Management",,,,Keystone,https://www.crunchbase.com/organization/keystone-5922,Antler
Pre Seed Round - Shaka Tel,https://www.crunchbase.com/funding_round/shaka-tel-pre-seed--55be6287,Pre-Seed,120000,GBP,150000,2023-04-24,1,1,Shaka specializes in offering telecommunication services that enable businesses to establish their customized mobile networks.,"Productivity Tools, Telecommunications",,,https://www.shaka.tel,Shaka Tel,https://www.crunchbase.com/organization/shaka-tel,Antler
Seed Round - HyperGPT,https://www.crunchbase.com/funding_round/hypergpt-seed--9f756297,Seed,480000,USD,480000,2023-05-01,1,3,HyperGPT is a marketplace for all AI solutions and seamless SDK where you can access integrated AI solutions.,"Artificial Intelligence, Blockchain, Machine Learning, Marketplace","Old Road Town, Saint Thomas Middle Island, Saint Kitts and Nevis, North America",,https://hypergpt.ai/,HyperGPT,https://www.crunchbase.com/organization/hypergpt,Ferrum Network
Pre Seed Round - Agri Sparta Indonesia,https://www.crunchbase.com/funding_round/agri-sparta-indonesia-pre-seed--af72deb9,Pre-Seed,125000,USD,125000,2023-04-26,1,1,Agri Sparta is establishing a network of modern farm shops and agricultural input logistics aimed at revolutionizing the farming industry.,"Agriculture, AgTech, Farming","Kedoya Selatan, Jakarta Raya, Indonesia, Asia",,https://www.agrisparta.com,Agri Sparta Indonesia,https://www.crunchbase.com/organization/agri-sparta-indonesia,Antler
Pre Seed Round - Grapefruit Health,https://www.crunchbase.com/funding_round/grapefruit-health-pre-seed--ccf20152,Pre-Seed,125000,USD,125000,2023-04-25,1,5,Grapefruit Health utilizes a clinical student workforce to perform interactions with patients remotely.,"Health Care, Medical, Training","Chicago, Illinois, United States, North America",,https://www.grapefruit.health/,Grapefruit Health,https://www.crunchbase.com/organization/grapefruit-health,Antler
Pre Seed Round - Zora Healthcare,https://www.crunchbase.com/funding_round/zora-healthcare-pre-seed--fcfff30f,Pre-Seed,125000,USD,125000,2023-04-28,1,1,Zora Health provides a range of medical tools and resources designed to support individuals on their fertility journey.,"Fertility, Health Care, Wellness","Singapore, Central Region, Singapore, Asia",,https://zorahealth.co,Zora Healthcare,https://www.crunchbase.com/organization/zora-healthcare,Antler
Pre Seed Round - Offer,https://www.crunchbase.com/funding_round/offer-9eea-pre-seed--1809edef,Pre-Seed,175000,USD,175000,2023-04-25,1,1,"Offer specializes in automated transaction management for realtors, offering a streamlined solution to handle the transaction process.","Business Development, Productivity Tools, Transaction Processing",,,https://www.offercrm.co,Offer,https://www.crunchbase.com/organization/offer-9eea,Antler
Pre Seed Round - Abode,https://www.crunchbase.com/funding_round/abode-4c27-pre-seed--99d82ee1,Pre-Seed,120000,GBP,150000,2023-04-24,1,1,Abode aims to provide a pathway to homeownership for countless families who currently face barriers to purchasing homes,"Property Development, Property Management, Real Estate","London, England, United Kingdom, Europe",,https://www.withabode.com,Abode,https://www.crunchbase.com/organization/abode-4c27,Antler
Pre Seed Round - inLike,https://www.crunchbase.com/funding_round/inlike-pre-seed--973aa285,Pre-Seed,185000,USD,185000,2023-05-12,1,1,InLike makes it easier for people to find and connect online and focus on building a stronger brand and increasing impact.,"Online Portals, Social, Social Media","Menlo Park, California, United States, North America",,https://www.inlike.social,inLike,https://www.crunchbase.com/organization/inlike,Antler
Seed Round - FreightRoll,https://www.crunchbase.com/funding_round/freightroll-seed--5cb4abc9,Seed,,,,2023-04-25,1,2,Inventory custody transfer and visibility platform,Transportation,"Ann Arbor, Michigan, United States, North America",Less than $1M,https://www.freightroll.com,FreightRoll,https://www.crunchbase.com/organization/freightroll,Michigan Rise
Seed Round - MediCool Technologies,https://www.crunchbase.com/funding_round/medicool-technologies-seed--0a6d7043,Seed,,,,2023-05-10,1,3,MediCool Technologies is a developer of a medical device to terminate atrial fibrillation.,Health Care,"Rochester, Minnesota, United States, North America",,http://medicooltech.com,MediCool Technologies,https://www.crunchbase.com/organization/medicool-technologies,Michigan Rise
Pre Seed Round - Ween,https://www.crunchbase.com/funding_round/ween-pre-seed--72059c19,Pre-Seed,150000,EUR,165158,2023-05-02,1,2,Ween's ambition is to make their living spaces autonomous.,"Artificial Intelligence, Automotive, Energy Efficiency, Internet of Things, Smart Home","Aix-en-provence, Provence-Alpes-Cote d'Azur, France, Europe",$1M to $10M,http://www.ween.ai,Ween,https://www.crunchbase.com/organization/ween,Antler
Seed Round - Arctic Farming,https://www.crunchbase.com/funding_round/arctic-farming-seed--9d4d3c32,Seed,350000,EUR,383967,2023-05-01,1,2,Arctic Farming is a AgriTech startup.,"B2B, Farming, Hydroponics, Retail","Espoo, Southern Finland, Finland, Europe",,https://arcticfarming.fi/,Arctic Farming,https://www.crunchbase.com/organization/arctic-farming,Heino Group
Pre Seed Round - Thunderbit,https://www.crunchbase.com/funding_round/thunderbit-pre-seed--8510beb3,Pre-Seed,1600000,USD,1600000,2023-05-01,1,1,Thunderbit is the fastest way to build AI workflow automation for everyone.,"Developer Tools, Marketing Automation, Productivity Tools, SaaS, Software, Software Engineering","San Francisco, California, United States, North America",,https://thunderbit.com/,Thunderbit,https://www.crunchbase.com/organization/thunderbit,Source Code Capital
Pre Seed Round - Markr,https://www.crunchbase.com/funding_round/markr-8fa2-pre-seed--8289cf9b,Pre-Seed,,,,2023-04-26,1,1,Markr is a complete Web3 platform that aims to help users' decision-making process on their investments.,,"Istanbul, Istanbul, Turkey, Europe",,https://www.markr.io,Markr,https://www.crunchbase.com/organization/markr-8fa2,Blizzard Fund
Seed Round - Worky,https://www.crunchbase.com/funding_round/worky-64dc-seed--b530a1ad,Seed,,,,2023-05-01,1,4,"Disrupting the way HR is managed at SMEs, while empowering employees in their benefit to financial health.","Financial Services, FinTech, Human Resources, SaaS","Mexico City, Distrito Federal, Mexico, North America",,http://www.worky.mx,Worky,https://www.crunchbase.com/organization/worky-64dc,BDev Ventures
Pre Seed Round - ENERZA,https://www.crunchbase.com/funding_round/enerza-59f6-pre-seed--677484a4,Pre-Seed,,,,2023-05-01,1,2,ENERZA provides a conditional risk assessment tool to electrical utility providers through autonomous on-wire robotic monitoring.,"Analytics, CleanTech, Energy, Predictive Analytics, Robotics",,,https://www.enerza.io,ENERZA,https://www.crunchbase.com/organization/enerza-59f6,Berkeley SkyDeck Fund
Pre Seed Round - GoodDeeds,https://www.crunchbase.com/funding_round/gooddeeds-pre-seed--c6091c59,Pre-Seed,,,,2023-05-05,1,2,GoodDeeds increases philanthropic ROI by empowering nonprofits to access more relevant funding and deploy it more effectively.,"Artificial Intelligence, Social Impact, Software","Tel Aviv-yafo, Tel Aviv, Israel, Asia",,https://gooddeeds.ai,GoodDeeds,https://www.crunchbase.com/organization/gooddeeds,Shayma Sharif
Seed Round - Sendspark,https://www.crunchbase.com/funding_round/sendspark-seed--4db11168,Seed,,,,2023-05-09,1,3,Sendspark is the video platform for record and requesting customer videos.,"Information Technology, Internet, Marketing, SaaS, Sales, Software, Video","San Antonio, Texas, United States, North America",,https://www.sendspark.com,Sendspark,https://www.crunchbase.com/organization/sendspark,Purple Sage Ventures
Seed Round - Character,https://www.crunchbase.com/funding_round/character-ffff-seed--fac81613,Seed,,,,2023-05-10,1,2,Character is a modern home improvement brand for the next generation of home dwellers.,"Consumer Goods, E-Commerce, Home Decor, Lifestyle","Chicago, Illinois, United States, North America",,https://withcharacter.com/,Character,https://www.crunchbase.com/organization/character-ffff,Purple Sage Ventures
Pre Seed Round - Benjamin,https://www.crunchbase.com/funding_round/benjamin-1caa-pre-seed--d51f1fb3,Pre-Seed,650000,USD,650000,2023-05-01,1,2,Financial Technology Mobile App,"Artificial Intelligence, Banking, Credit Cards, Debit Cards, FinTech, Mobile Apps, Software","New York, New York, United States, North America",,https://www.benjaminone.com,Benjamin,https://www.crunchbase.com/organization/benjamin-1caa,Antler
Seed Round - Scape Mexico,https://www.crunchbase.com/funding_round/scape-mexico-seed--1393a578,Seed,,,,2023-05-01,1,3,Scape Mexico is an app for home service.,"Apps, Mobile Apps","Mexico City, Distrito Federal, Mexico, North America",,https://scape.mx/,Scape Mexico,https://www.crunchbase.com/organization/scape-mexico,Daedalus Ventures
Seed Round - SmallTalk2.me,https://www.crunchbase.com/funding_round/smalltalk-730f-seed--b40f8ae5,Seed,,,,2023-05-08,1,2,AI-based simulator for improving English speaking skills and automated business assessment tests.,"EdTech, Education, Language Learning, Natural Language Processing","Walnut, California, United States, North America",,https://smalltalk2.me/,SmallTalk2.me,https://www.crunchbase.com/organization/smalltalk-730f,Dmitry Stavisky
Seed Round - Swapifly,https://www.crunchbase.com/funding_round/swapifly-seed--4921ae1b,Seed,150000,USD,150000,2023-04-25,1,2,Swapifly is a Hong Kong based classified online marketplace,"Advertising Platforms, Classifieds, Digital Marketing, E-Commerce Platforms, Internet, Marketplace, Social Media Marketing","Hong Kong, Hong Kong Island, Hong Kong, Asia",,https://www.swapifly.com,Swapifly,https://www.crunchbase.com/organization/swapifly,Hong Kong Science and Technology Parks Corporation (HKSTP)
Seed Round - Perceptyne Robots,https://www.crunchbase.com/funding_round/perceptyne-robots-seed--15c24833,Seed,723563,USD,723563,2023-04-24,,1,"Perceptyne Robots is a deep-tech robotics firm developing dexterous, affordable, and contextually aware robots.","Industrial Automation, Machine Learning, Robotics","Hyderabad, Andhra Pradesh, India, Asia",,https://www.perceptyne.com/,Perceptyne Robots,https://www.crunchbase.com/organization/perceptyne-robots,
Seed Round - Monument,https://www.crunchbase.com/funding_round/monument-55b9-seed--c0819608,Seed,12000000,USD,12000000,2023-05-01,1,1,Monument is a software platform for the self-storage industry that manages large portfolios of facilities.,"B2B, SaaS, Self-Storage, Software","Dallas, Texas, United States, North America",,https://monument.io/,Monument,https://www.crunchbase.com/organization/monument-55b9,Woodland Capital
Seed Round - Fire Pit Collective,https://www.crunchbase.com/funding_round/fire-pit-collective-seed--368ed560,Seed,150000,USD,150000,2023-04-24,,3,Fire Pit Collective is committed to storytelling and authentic content distributed across various platforms and outlets all over the world.,"Content, Information Services, Social News","Oceanside, California, United States, North America",,https://firepitcollective.com,Fire Pit Collective,https://www.crunchbase.com/organization/fire-pit-collective,
Seed Round - Tapps Electric,https://www.crunchbase.com/funding_round/tapps-electric-seed--a4af706e,Seed,500000,USD,500000,2023-04-24,,1,Tapps Electric is a full service electrical contractor that provides services for all types of electrical and construction industries.,"Commercial, Construction, Electrical Distribution, Industrial, Residential","Sumner, Washington, United States, North America",,https://tappselectric.com/,Tapps Electric,https://www.crunchbase.com/organization/tapps-electric,
Pre Seed Round - IndicatorLab,https://www.crunchbase.com/funding_round/indicatorlab-pre-seed--aec5de6b,Pre-Seed,,,,2023-05-01,1,1,Investor's Copilot Driven by Generative AI,FinTech,"Santa Clara, California, United States, North America",,https://indicatorlab.xyz/,IndicatorLab,https://www.crunchbase.com/organization/indicatorlab,Sunstone Management
Pre Seed Round - CashWise,https://www.crunchbase.com/funding_round/cashwise-pre-seed--18603444,Pre-Seed,125000,USD,125000,2023-05-05,1,1,"Treasury Management SaaS for Businesses - Plan, Deploy, Manage and Monitor Fixed Income Investments in a Safe and Passive way","Financial Services, FinTech, SaaS","Singapore, Central Region, Singapore, Asia",,https://www.cashwise.asia,CashWise,https://www.crunchbase.com/organization/cashwise,Antler
Seed Round - Anyone.com,https://www.crunchbase.com/funding_round/anyone-com-seed--b135075c,Seed,3000000,EUR,3291151,2023-05-01,1,1,"We are Anyone.com, a company that is on a mission to enable anyone to own a home.","Financial Services, Information Technology, Real Estate, Software","Amsterdam, Noord-Holland, The Netherlands, Europe",,https://anyone.com,Anyone.com,https://www.crunchbase.com/organization/anyone-com,Reza Sardeha
Pre Seed Round - Conspire Commerce,https://www.crunchbase.com/funding_round/conspire-commerce-pre-seed--fa461c21,Pre-Seed,2000,USD,2000,2023-05-01,,1,"Conspire is a social shopping platform that allows users to shop together in real-time, split costs, and share opinions on products.",E-Commerce,"San Luis Obispo, California, United States, North America",,https://conspirecommerce.com,Conspire Commerce,https://www.crunchbase.com/organization/conspire-commerce,
Seed Round - SpenDebt,https://www.crunchbase.com/funding_round/spendebt-seed--1881f464,Seed,,,,2023-05-12,1,5,SpenDebt is a financial technology company helping save one million families from financial fatalities with every purchased made.,"Finance, Financial Services, FinTech","St Louis, Missouri, United States, North America",,https://www.spendebt.com,SpenDebt,https://www.crunchbase.com/organization/spendebt,HBCU Founders Accelerator
Pre Seed Round - Molito.ai,https://www.crunchbase.com/funding_round/molito-ai-pre-seed--5cb506ba,Pre-Seed,,,,2023-05-02,1,1,"Molito AIDE is an innovative open-source Business Rules Management System, powered by AI and based on Microsoft Azure.",,,,https://www.molito.ai/,Molito.ai,https://www.crunchbase.com/organization/molito-ai,LID Group
Pre Seed Round - PT Center,https://www.crunchbase.com/funding_round/pt-center-pre-seed--f2f24931,Pre-Seed,100000,EUR,109705,2023-05-01,1,1,Personal Training Center,"Fitness, Personal Health","Haarlem, Noord-Holland, The Netherlands, Europe",,https://ptcenter.nl,PT Center,https://www.crunchbase.com/organization/pt-center,RS Participaties
Pre Seed Round - Midnight Parachute Cold Brew,https://www.crunchbase.com/funding_round/midnight-parachute-cold-brew-pre-seed--61c80a8c,Pre-Seed,,,,2023-05-10,1,1,E-Commerce Coffee Company Selling Single Serving Cold Brew Pods,"E-Commerce, Food and Beverage, Retail","St Louis, Missouri, United States, North America",,https://nixoneast.com,Midnight Parachute Cold Brew,https://www.crunchbase.com/organization/midnight-parachute-cold-brew,Holekamp Seed Fund
Pre Seed Round - The Portfolio Collective,https://www.crunchbase.com/funding_round/the-portfolio-collective-pre-seed--bb4a095d,Pre-Seed,,,,2023-05-03,1,3,The lifetime accelerator for portfolio professionals,"Collaboration, Communities, Employment, Professional Networking, Training, Virtual Workforce","London, England, United Kingdom, Europe",,http://portfolio-collective.com/,The Portfolio Collective,https://www.crunchbase.com/organization/the-portfolio-collective,NoBa Capital
Pre Seed Round - Procyon,https://www.crunchbase.com/funding_round/procyon-70d5-pre-seed--ad2a1df7,Pre-Seed,50000,USD,50000,2023-05-02,1,1,Optical hardware to cut costs in scaling and maintaining AI systems.,"Hardware, Machine Learning, Semiconductor","Ashburn, Virginia, United States, North America",,https://procyoncorp.io/,Procyon,https://www.crunchbase.com/organization/procyon-70d5,1517 Fund
Seed Round - MetaParallel,https://www.crunchbase.com/funding_round/metaparallel-seed--f7204e91,Seed,450000,USD,450000,2023-05-08,2,1,Women-led tech company applying SOTAs to create innovations for a sustainable new era. Empowering individuals and businesses to thrive.,"Artificial Intelligence, Blockchain, Information Services, Information Technology, Internet, Software","Palo Alto, California, United States, North America",,https://metaparallel.net,MetaParallel,https://www.crunchbase.com/organization/metaparallel,"Google, Valkyrie Fund"
Pre Seed Round - Assemble,https://www.crunchbase.com/funding_round/assemble-4336-pre-seed--01a67e78,Pre-Seed,1200000,USD,1200000,2023-05-09,1,1,"Assemble is a digital platform that connects nurses to the content, coaching and community to help them thrive.",,"New York, New York, United States, North America",,https://ComeAssemble.com,Assemble,https://www.crunchbase.com/organization/assemble-4336,Surface Ventures
Pre Seed Round - Persona,https://www.crunchbase.com/funding_round/persona-c462-pre-seed--ade9c4f0,Pre-Seed,125000,USD,125000,2023-04-28,1,1,Persona creates artificial intelligence personas & assistants so our users can solve complex life challenges.,"Artificial Intelligence, Software","Singapore, Central Region, Singapore, Asia",,http://getpersona.ai,Persona,https://www.crunchbase.com/organization/persona-c462,Antler
Seed Round - Musiversal,https://www.crunchbase.com/funding_round/musiversal-seed--cfd4f04a,Seed,1900000,USD,1900000,2023-05-01,1,6,Music Production Managed Marketplace,"Marketplace, Music","Lisbon, Lisboa, Portugal, Europe",,https://www.musiversal.com/,Musiversal,https://www.crunchbase.com/organization/musiversal,Iberis Capital
Seed Round - Optimyzee,https://www.crunchbase.com/funding_round/optimyzee-seed--e8dd67a2,Seed,,,,2023-04-24,1,1,Your Digital Senior PPC Expert,"Advertising, AgTech, Artificial Intelligence, Machine Learning, Marketing, Marketing Automation","Yerevan, Yerevan, Armenia, Asia",,https://www.optimyzee.com/,Optimyzee,https://www.crunchbase.com/organization/optimyzee,Triple S Ventures
Seed Round - Sentinel Fertigation,https://www.crunchbase.com/funding_round/sentinel-fertigation-seed--47f32af0,Seed,1500000,USD,1500000,2023-04-26,1,3,Sentinel Fertigation develops the fertigation management platform that uses aerial imagery.,"Agriculture, AgTech, Software","Lincoln, Nebraska, United States, North America",,https://www.sentinelfertigation.com/,Sentinel Fertigation,https://www.crunchbase.com/organization/sentinel-fertigation,Invest Nebraska
Pre Seed Round - Tiiga,https://www.crunchbase.com/funding_round/tiiga-pre-seed--ac08a221,Pre-Seed,480000,USD,480000,2023-05-05,1,6,Tiiga offers a powdered beverage mix that promotes a healthy microbiome and improved overall health.,"Fitness, Food and Beverage, Wellness","Lincoln, Nebraska, United States, North America",,https://drinktiiga.com,Tiiga,https://www.crunchbase.com/organization/tiiga,Invest Nebraska
