Seed Round - Zomoz,https://www.crunchbase.com/funding_round/zomoz-7e62-seed--655cea0f,Seed,164000000,INR,2005410,2023-05-02,2,2,"Zomoz provides momos, dim sum, and shumais.","Food and Beverage, Restaurants, Snack Food","Hyderabad, Andhra Pradesh, India, Asia",,https://www.zomoz.co.in/,Zomoz,https://www.crunchbase.com/organization/zomoz-7e62,"KYT Ventures, Rebel Foods"
Seed Round - Siphon Lab,https://www.crunchbase.com/funding_round/siphon-lab-seed--f0bc08f1,Seed,1200000,USD,1200000,2023-05-08,5,1,"Siphon Lab is a cryptocurrency DeFi startup, aims to maximize the capital efficiency of SUI across the ecosystem.",Cryptocurrency,"Mill Valley, California, United States, North America",,https://www.siphonlab.org/,Siphon Lab,https://www.crunchbase.com/organization/siphon-lab,"BT Growth Capital, Kima Ventures, MAVA Ventures, Uno Ventures, Waveline Ventures"
Pre Seed Round - Ohm Mobility,https://www.crunchbase.com/funding_round/ohm-mobility-pre-seed--2d76c999,Pre-Seed,30000000,INR,366843,2023-05-02,6,1,Ohm Mobility is a platform that provides fintech and clean transportation services.,"Clean Energy, CleanTech, Transportation","Bangalore, Karnataka, India, Asia",,https://www.ohmmobility.com/,Ohm Mobility,https://www.crunchbase.com/organization/ohm-mobility,"Anshuman Bapna, Antler India, Blume Founders Fund, Karishma Menon, Mathew Chako, Sagar Gubbi"
Seed Round - Deciml,https://www.crunchbase.com/funding_round/deciml-seed--deb872d8,Seed,,,,2023-04-24,11,2,Deciml is an app that automatically rounds up online transactions and instantly invests the spare change.,"Apps, Financial Services, Personal Finance","Pune, Maharashtra, India, Asia",,https://deciml.in/,Deciml,https://www.crunchbase.com/organization/deciml,"Abhishek Oswal, Blaze Management Labs, Chirag Gandhi, Hemant Ruprell, Rasiklal R. Thakker, Sandeep Kumar Chawda, Saurabh Abbi, Shashank Deshpande, Vinit Pardeshi, Viraj Savant, Zakir Khan"
Seed Round - Verteego,https://www.crunchbase.com/funding_round/verteego-seed--2339382e,Seed,2500000,EUR,2757899,2023-04-27,10,3,"Verteego provides customizable AI solutions to retail and CPGs to optimize prices, promotions, inventory, assortment and resources.","Analytics, Artificial Intelligence, E-Commerce, Machine Learning","Paris, Ile-de-France, France, Europe",,http://www.verteego.com,Verteego,https://www.crunchbase.com/organization/verteego,"Archipel Ventures, Bpifrance, Charles Egly, Etienne Besançon, Finoli, Guillaume Princen, Holnest, Kima Ventures, Loïc Villers, Super Capital VC"
Seed Round - Heliware,https://www.crunchbase.com/funding_round/heliware-seed--c559b547,Seed,70000000,INR,856621,2023-05-04,3,4,"Heliware is a Geo-spatial start-up in India which provides analytics, modeling, simulation and visualization of spatial data.","Analytics, Artificial Intelligence, Geospatial","Haryana, Haryana, India, Asia",,https://www.heliware.co.in,Heliware,https://www.crunchbase.com/organization/heliware,"Amit Engineers, JITO Angel Network, TiE India Angels"
Seed Round - Fair Winds Candle Company,https://www.crunchbase.com/funding_round/fair-winds-candle-company-seed--a411ecd4,Seed,,,,2023-05-08,1,1,Fair Winds Candle Company is a home fragrance brand specializing in scented candles.,"Consumer Goods, Manufacturing",,,https://www.fairwindscandle.com,Fair Winds Candle Company,https://www.crunchbase.com/organization/fair-winds-candle-company,Home-Run Accelerator
Seed Round - Sweet Smith’s bakery,https://www.crunchbase.com/funding_round/sweet-smith-s-bakery-seed--f6f2d29c,Seed,,,,2023-05-08,1,1,Sweet Smith’s bakery produces hand-crafted baked goods.,"Bakery, Food Processing, Snack Food","Baltimore, Maryland, United States, North America",,,Sweet Smith’s bakery,https://www.crunchbase.com/organization/sweet-smith-s-bakery,Home-Run Accelerator
Seed Round - Luxet,https://www.crunchbase.com/funding_round/luxet-seed--2154eee4,Seed,,,,2023-05-08,1,1,"Luxet is providing advanced nano-optical detection technology for industry, scientific research, and medical circles.","Advanced Materials, Semiconductor","Suzhou, Jiangsu, China, Asia",,https://www.luxet.cn/#/,Luxet,https://www.crunchbase.com/organization/luxet,Baoding Investment
Pre Seed Round - Sensible,https://www.crunchbase.com/funding_round/sensible-bd34-pre-seed--7824e312,Pre-Seed,,,,2023-05-09,2,1,Sensible is a company that specializes in creating continuous biosensor platforms of the future generation.,"Health Care, Manufacturing, Medical, Medical Device","Delft, Zuid-Holland, The Netherlands, Europe",,https://sensible.health,Sensible,https://www.crunchbase.com/organization/sensible-bd34,"Glass Frog Ventures, Graduate Entrepreneur Fund"
Seed Round - We Are Emma,https://www.crunchbase.com/funding_round/we-are-emma-seed--487e551b,Seed,1600000,EUR,1793701,2023-05-05,7,1,We Are Emma is a provider of salon amenities and products meant to promote healthy hair.,"Beauty, Cosmetics, Retail","Milan, Lombardia, Italy, Europe",,https://weareemma.com,We Are Emma,https://www.crunchbase.com/organization/we-are-emma,"Caravatti, Ceresio Investors, Grippo, Lazzaroni, Marco Coin, Matteo de Brabant, Visconti"
Seed Round - Frontline Wildfire Defense,https://www.crunchbase.com/funding_round/frontline-wildfire-defense-seed--89256c28,Seed,6400000,USD,6400000,2023-05-01,1,2,Frontline Wildfire Defense is an application that protects private property from wildfire.,"Apps, Consumer Applications, Public Safety, Service Industry","San Francisco, California, United States, North America",,https://www.frontlinewildfire.com,Frontline Wildfire Defense,https://www.crunchbase.com/organization/frontline-wildfire-defense,Echelon
Seed Round - Fermify,https://www.crunchbase.com/funding_round/fermify-seed--f97835dc,Seed,5000000,USD,5000000,2023-05-09,3,2,Fermify is to domesticate microorganisms and build a super simple and fully automated production platform.,"Biopharma, Biotechnology","Gerasdorf Bei Wien, Niederosterreich, Austria, Europe",,https://www.fermify.org/,Fermify,https://www.crunchbase.com/organization/fermify,"Auxxo, Climentum Capital, Satgana"
Seed Round - Sugar Watchers,https://www.crunchbase.com/funding_round/sugar-watchers-seed--17e32969,Seed,36000000,INR,440548,2023-05-04,6,2,Sugar Watchers is the manufacturers of Low GI (Glycemic Index) foods.,"Food Processing, Organic Food","Mumbai, Maharashtra, India, Asia",,https://sugarwatchers.in,Sugar Watchers,https://www.crunchbase.com/organization/sugar-watchers,"ah! Ventures, Chandigarh Angels Network, Keiretsu Forum, Mumbai Angels, Sanjiv Rangrass, The Chennai Angels"
Pre Seed Round - Griptape,https://www.crunchbase.com/funding_round/griptape-pre-seed--881116c9,Pre-Seed,2050000,USD,2050000,2023-05-12,4,1,Griptape is an enterprise-grade Python framework that empowers developers to harness LLMs' potential.,"Artificial Intelligence, Data Integration, Enterprise Software, Internet, Machine Learning",,,https://www.griptape.ai/,Griptape,https://www.crunchbase.com/organization/griptape,"Acequia Capital (AceCap), Peterson Ventures, Range Ventures, Service Provider Capital"
Seed Round - Centuro Global,https://www.crunchbase.com/funding_round/centuro-global-seed--baef5648,Seed,3300000,GBP,4147437,2023-04-28,1,1,Centuro Global helps companies enter new markets around the world through the world's first all encompassing global expansion platform.,"Human Resources, Legal Tech, Professional Networking, Professional Services","London, England, United Kingdom, Europe",,https://www.centuroglobal.com/,Centuro Global,https://www.crunchbase.com/organization/centuro-global,Mercia Fund Managers
Seed Round - Aksum Trademart,https://www.crunchbase.com/funding_round/aksum-trademart-seed--fcaed606,Seed,1000000,USD,1000000,2023-04-27,1,2,Aksum Trademart which helps supply raw materials to SMBs and enterprises.,,"Connaught Place, Delhi, India, Asia",,https://aksum.co.in/,Aksum Trademart,https://www.crunchbase.com/organization/aksum-trademart,Inflection Point Ventures
Seed Round - Drest,https://www.crunchbase.com/funding_round/drest-6096-seed--04bceae4,Seed,336000,USD,336000,2023-04-30,1,1,"Drest is an e-commerce platform that sells everything from ready-to-wear to beauty, as well as accessories and fashion items.","Cosmetics, E-Commerce Platforms, Fashion","Tunis, Tunis, Tunisia, Africa",,https://www.drest.tn,Drest,https://www.crunchbase.com/organization/drest-6096,216 Capital
Seed Round - Sparrow Quantum,https://www.crunchbase.com/funding_round/sparrow-quantum-seed--4091391b,Seed,4100000,EUR,4473979,2023-05-11,3,4,Sparrow Quantum develope and commercializes photonic quantum technology components.,"Manufacturing, Semiconductor","Copenhagen, Hovedstaden, Denmark, Europe",$1M to $10M,http://sparrowquantum.com/,Sparrow Quantum,https://www.crunchbase.com/organization/sparrow-quantum,"2xN, European Innovation Council, LIFTT"
Seed Round - IDPartner,https://www.crunchbase.com/funding_round/idpartner-seed--74e969d9,Seed,3100000,USD,3100000,2023-04-25,7,1,IDPartner is a startup providing online identity verification through a network of financial institutions,"Information Services, Information Technology, Internet","San Francisco, California, United States, North America",,https://www.idpartner.com,IDPartner,https://www.crunchbase.com/organization/idpartner,"Abstract Ventures, Aleo, Circle Ventures, Correlation Ventures, Firsthand Alliance, Foundation Capital, Success Venture"
Seed Round - AirOps,https://www.crunchbase.com/funding_round/airops-1e31-seed--89489109,Seed,7000000,USD,7000000,2023-04-26,6,1,AirOps allows users to create AI-enabled applications on top of Large Language Models (LLMs).,"Business Development, Developer APIs, Developer Tools, Productivity Tools","Miami, Florida, United States, North America",,https://www.airops.com,AirOps,https://www.crunchbase.com/organization/airops-1e31,"Apollo Projects, Founder Collective, Lachy Groom, Village Global, Wing Venture Capital, Xfund"
Seed Round - Springbok Analytics,https://www.crunchbase.com/funding_round/springbok-analytics-seed--a1d0940f,Seed,3000000,USD,3000000,2023-04-25,5,4,Springbok Analytics offers an AI-powered platform that transforms MRIs into three-dimensional analyses of muscle to enable true precision.,,"Charlottesville, Virginia, United States, North America",,http://www.springbokanalytics.com/,Springbok Analytics,https://www.crunchbase.com/organization/springbok-analytics,"CAV Angels, Chicago Blackhawks, FSHD Global, TitletownTech, Transition Equity Partners"
Seed Round - Tristero,https://www.crunchbase.com/funding_round/tristero-seed--30791f83,Seed,4800000,USD,4800000,2023-05-03,2,1,Tristero develops dark-pool technology to make trading environments more transparent.,"Blockchain, Security, Technical Support, Trading Platform","San Francisco, California, United States, North America",,https://www.tristero.xyz,Tristero,https://www.crunchbase.com/organization/tristero,"General Catalyst, Steel Perlot"
Seed Round - travel.win,https://www.crunchbase.com/funding_round/travel-win-seed--6956233f,Seed,550000,USD,550000,2023-05-08,,1,travel.win is a provider that makes it easy for companies with an existing user base to increase revenue and customer engagement.,"Hospitality, Service Industry, Travel","Fort Lauderdale, Florida, United States, North America",,https://travel.win/,travel.win,https://www.crunchbase.com/organization/travel-win,
Seed Round - Synco,https://www.crunchbase.com/funding_round/synco-3ed4-seed--7cb60ab4,Seed,5500000,USD,5500000,2023-05-10,3,1,Synco is a real-time messaging desktop and mobile app for property management.,"Property Management, Software","Pelham, New York, United States, North America",,https://teamsynco.com/,Synco,https://www.crunchbase.com/organization/synco-3ed4,"Adam Pittenger, Caren Maio, MetaProp"
Seed Round - DFlow,https://www.crunchbase.com/funding_round/dflow-seed--38a7accc,Seed,5500000,USD,5500000,2023-04-25,18,2,DFlow is a decentralized order flow marketplace platform dedicated to providing retail traders with liquidity source support.,"Blockchain, Cryptocurrency, Marketplace","América, Managua, Nicaragua, North America",,https://dflow.net,DFlow,https://www.crunchbase.com/organization/dflow,"Benedict Brady, Circle Ventures, Coinbase Ventures, Cumberland, Evgeny Yurtaev, Framework Ventures, Gabriel Tan, Jayendra Jog, John Lantz, Maghnus Mareneck, Neel Somani, Paul Burlage, Samuel Berman, Stepan Simkin, Stephane Gosselin, The Spartan Group, Wintermute, Zee Prime Capital"
Seed Round - Parex Market,https://www.crunchbase.com/funding_round/parex-market-seed--ffd31be7,Seed,6500000,USD,6500000,2023-05-12,2,1,Parex Market provides DAO ecocsystem that includes a range of solutions.,"Cryptocurrency, Financial Services","Wilmington, Delaware, United States, North America",,https://www.parex.market/,Parex Market,https://www.crunchbase.com/organization/parex-market,"Bitgert, DWF Labs"
Seed Round - QuickReply.ai,https://www.crunchbase.com/funding_round/quickreply-ai-seed--6e29426e,Seed,93100000,INR,1138639,2023-04-27,6,1,QuickReply.ai is a pre-built WhatsApp commerce solution for online store platforms.,"Information Technology, Internet, Software","Haryana, Haryana, India, Asia",,https://www.quickreply.ai,QuickReply.ai,https://www.crunchbase.com/organization/quickreply-ai,"Azhar Iqubal, Deepak Diwakar, Dinesh Agarwal, GSF, Leo Capital, Pentathlon Ventures"
Seed Round - UniSieve,https://www.crunchbase.com/funding_round/unisieve-seed--ef9cca3f,Seed,4900000,EUR,5412295,2023-04-26,4,11,UniSieve is a cleantech company that provides molecular separation membrane solutions for a wide range of applications.,"Chemical, CleanTech, Oil and Gas, Renewable Energy","Zürich, Zurich, Switzerland, Europe",Less than $1M,https://www.unisieve.com/,UniSieve,https://www.crunchbase.com/organization/unisieve,"Amadeus APEX Technology Fund, Ciech Ventures, Wingman Ventures, Zürcher Kantonal Bank"
Pre Seed Round - Fanton,https://www.crunchbase.com/funding_round/fanton-32f0-pre-seed--a6bb61ec,Pre-Seed,300000,USD,300000,2023-04-28,4,1,Fanton is a football genre that has been integrated into the Telegram app.,"Cryptocurrency, Digital Entertainment, Gaming, Mobile Apps","Yafo, Tel Aviv, Israel, Asia",,https://fan-ton.com,Fanton,https://www.crunchbase.com/organization/fanton-32f0,"Emmanuel Costa, Existential Capital, First Stage Labs, Yolo Investments"
Seed Round - NinjaTech AI,https://www.crunchbase.com/funding_round/ninjatech-ai-seed--859cd1fe,Seed,5000000,USD,5000000,2023-05-02,4,1,NinjaTech AI is a business developing the genuine next-generation personal assistant using generative AI.,"Artificial Intelligence, Internet, Virtual Assistant","Palo Alto, California, United States, North America",,https://www.ninjatech.ai,NinjaTech AI,https://www.crunchbase.com/organization/ninjatech-ai,"Candou Ventures, DCVC, Laszlo Bock, SRI Ventures"
Pre Seed Round - Quaisr,https://www.crunchbase.com/funding_round/quaisr-pre-seed--cbeae5a5,Pre-Seed,3100000,USD,3100000,2023-05-02,4,1,Quaisr develops simulations for the full digital-twin lifecycle.,"Simulation, Software","London, England, United Kingdom, Europe",,https://www.quaisr.io,Quaisr,https://www.crunchbase.com/organization/quaisr,"Acequia Capital (AceCap), Carsten Thoma, Crane Venture Partners, Eric Landau"
Pre Seed Round - XHYPE,https://www.crunchbase.com/funding_round/xhype-pre-seed--1f6b5ea7,Pre-Seed,1800000,EUR,1984157,2023-05-04,1,1,The Xhype marketplace provides experiences ranging from trips and excursions.,"Information Technology, Internet","Dubai, Dubai, United Arab Emirates, Asia",,https://www.linkedin.com/company/xhypetoken,XHYPE,https://www.crunchbase.com/organization/xhype,Holders&Brothers
Seed Round - Glass | Government Ecosystems,https://www.crunchbase.com/funding_round/social-glass-seed--b5814974,Seed,3500000,USD,3500000,2023-05-04,11,3,e-Commerce startup revolutionizing how governments buy.,"Government, Procurement","San Francisco, California, United States, North America",Less than $1M,https://discover.glass/,Glass | Government Ecosystems,https://www.crunchbase.com/organization/social-glass,"Alchemist Accelerator, Alcove Investment Management, KittyHawk Ventures, New Age Capital, Newtopia VC, One Planet, One Planet Group, Payam Zamani, SV Links, Tubbs Ventures, Worldgate Group"
Pre Seed Round - Carbonhound,https://www.crunchbase.com/funding_round/carbonhound-pre-seed--eaa9449d,Pre-Seed,1300000,CAD,971922,2023-05-09,3,3,Carbonhound is a carbon management platform that helps SMEs transition to a low-carbon economy.,Software,"Toronto, Ontario, Canada, North America",,https://carbonhound.com/,Carbonhound,https://www.crunchbase.com/organization/carbonhound,"Archangel Network of Funds, Highline Beta, Verdexus"
Seed Round - CRUXO,https://www.crunchbase.com/funding_round/cruxo-seed--baa8b53f,Seed,800000,EUR,885479,2023-05-03,3,1,"Enabling retailers to boost revenues and profitability by employing data, targeting and native formats in one platform.","Advertising Platforms, Retail","Prague, Hlavni mesto Praha, Czech Republic, Europe",,https://cruxo.io/en/,CRUXO,https://www.crunchbase.com/organization/cruxo,"Czech Founders VC, Presto Ventures, ZAKA VC"
Seed Round - Spawning,https://www.crunchbase.com/funding_round/spawning-seed--c2e3cca7,Seed,3000000,USD,3000000,2023-05-03,7,1,Spawning is a phrase coined to describe the act of creating wholly new media with an AI system trained on existing material.,"Digital Media, Information Services","Minneapolis, Minnesota, United States, North America",,https://spawning.ai,Spawning,https://www.crunchbase.com/organization/spawning,"Abhay Parasnis, Balaji Srinivisan, Charles Songhurst, Jacob eth, Noise DAO, seedclub, True Ventures"
Seed Round - MetaCRM,https://www.crunchbase.com/funding_round/metacrm-seed--58152da5,Seed,2500000,USD,2500000,2023-04-25,4,1,Best Web3 CRM Solution Provider,"Blockchain, CRM","Taiwan, Jiangsu, China, Asia",,https://metacrm.inc/#/,MetaCRM,https://www.crunchbase.com/organization/metacrm,"Cherubic Ventures, Ondine Capital, Red Building Capital, Tribe"
Seed Round - MeuChapa,https://www.crunchbase.com/funding_round/meuchapa-seed--813f486e,Seed,5100000,BRL,1022617,2023-05-09,3,2,MeuChapa is a logtech digital platform that provides workforce solutions for logistics and supply chains.,"Apps, Logistics, Supply Chain Management","Campina, Sao Paulo, Brazil, South America",,https://meuchapa.net,MeuChapa,https://www.crunchbase.com/organization/meuchapa,"Gvangels, Tompkins Ventures, Venture Hub"
Pre Seed Round - Inspecity,https://www.crunchbase.com/funding_round/inspecity-pre-seed--2d13395b,Pre-Seed,123000000,INR,1500149,2023-04-25,6,2,Inspecity build human homes that go beyond the constraints of our current planetary systems and establish a new economy in space.,"Aerospace, Space Travel","Thane, Maharashtra, India, Asia",,https://www.inspecity.com,Inspecity,https://www.crunchbase.com/organization/inspecity,"Anicut Capital, Antler, DeVC India, PointOne Capital, Speciale Invest, Veda VC"
Seed Round - Tendo Technologies,https://www.crunchbase.com/funding_round/tendo-technologies-seed--5d499b89,Seed,,,,2023-05-05,2,5,Tendo is a technology company that provides economical solutions for flow rate and pressure measurements.,Mechanical Engineering,"Princeton, New Jersey, United States, North America",,http://www.tendo.tech/,Tendo Technologies,https://www.crunchbase.com/organization/tendo-technologies,"Rhapsody Venture Partners, Tyche"
Seed Round - Pin Point,https://www.crunchbase.com/funding_round/pin-point-seed--bf1684e7,Seed,,,,2023-05-05,1,1,Pin Point is a high-tech company specializing in the research and development of high-precision positioning system products and solutions.,"Industrial, Service Industry","Hangzhou, Zhejiang, China, Asia",,http://www.pinpointloc.com/,Pin Point,https://www.crunchbase.com/organization/pin-point,ZSVC
Seed Round - Bits Technology,https://www.crunchbase.com/funding_round/bits-technology-seed--3406f90e,Seed,4000000,EUR,4412639,2023-04-27,4,2,The Bits platform both orchestrates and automates the management of other fintechs’ infrastructure providers with a low-code experience.,"Financial Services, FinTech","Stockholm, Stockholms Lan, Sweden, Europe",,https://www.bits.bi/,Bits Technology,https://www.crunchbase.com/organization/bits-technology,"Alliance Ventures, Cherry Ventures, Fin Capital, Unusual Ventures"
Pre Seed Round - DataFret,https://www.crunchbase.com/funding_round/datafret-pre-seed--148e904d,Pre-Seed,500000,EUR,560531,2023-05-05,5,1,DataFret aids in the automation of goods invoicing processing.,"Logistics, Supply Chain Management, Transportation","Bordeaux, Aquitaine, France, Europe",,https://datafret.com,DataFret,https://www.crunchbase.com/organization/datafret,"Bpifrance, Crédit Agricole Alpes Provence, Finaqui Business Angels, Societe Generale, Thebault Thierry"
Pre Seed Round - Nolus,https://www.crunchbase.com/funding_round/nolus-pre-seed--2f1f723a,Pre-Seed,,,,2023-05-02,,3,Nolus is an interoperable application on Cosmos.,"Asset Management, Financial Services, Risk Management",,,https://nolus.io/,Nolus,https://www.crunchbase.com/organization/nolus,
Pre Seed Round - Amorai,https://www.crunchbase.com/funding_round/amorai-pre-seed--58b3448c,Pre-Seed,,,,2023-04-27,8,1,Amorai offers an AI relationship coaching app targeting young adults.,"Artificial Intelligence, Information Technology, Personal Health","San Francisco, California, United States, North America",,https://amorai.co,Amorai,https://www.crunchbase.com/organization/amorai,"AI Fund, André Heinz, Charles Roberts, Eileen Burbidge, Jim Lanzone, Joe Zadeh, Megan Jones Bell, Peter Rojas"
Seed Round - Elmo,https://www.crunchbase.com/funding_round/elmo-a37e-seed--4695f4d1,Seed,2600000,EUR,2871830,2023-04-26,4,1,"Elmo Remote is a state-of-the-art tool, enables to deliver vehicles directly to customers.","Customer Service, Rental, Service Industry","Tallinn, Harjumaa, Estonia, Europe",,https://www.elmoremote.com,Elmo,https://www.crunchbase.com/organization/elmo-a37e,"Barolo Investment Partners, FlyCap, Highgoal Capital, Water Ways Technologies"
Seed Round - Mhaya,https://www.crunchbase.com/funding_round/mhaya-seed--af493f51,Seed,5000000,USD,5000000,2023-05-13,1,1,"Mhaya is the world's first ""Monopoly-GameFi"" city simulation game in GameFi,advocates for free play and leisure entertainment.",,,,https://mhaya.com/,Mhaya,https://www.crunchbase.com/organization/mhaya,Firestone Global
Seed Round - Phantom Gamelabs,https://www.crunchbase.com/funding_round/phantom-gamelabs-seed--4fdedfdc,Seed,,,,2023-05-05,1,1,Phantom Gamelabs is a mobile game studio that specializes in multiplayer Action RPGs and Looter Shooter games.,"Gaming, Information Technology, Software","Helsinki, Southern Finland, Finland, Europe",,https://phantomgamelabs.com,Phantom Gamelabs,https://www.crunchbase.com/organization/phantom-gamelabs,Supercell
Seed Round - Retreat,https://www.crunchbase.com/funding_round/retreat-seed--f70d8504,Seed,1550000,USD,1550000,2023-05-08,9,3,Budget friendly corporate offsite planner,,"San Francisco, California, United States, North America",,https://planretreat.com,Retreat,https://www.crunchbase.com/organization/retreat,"90s, CyberAgent Capital, Egg Forward, Hiro Mizushima, MIRAISE, MITSUI SUMITOMO INSURANCE Venture Capital (MSIVC), ScoutFund, UB Ventures, Yuki Ota"
Seed Round - Maholla,https://www.crunchbase.com/funding_round/maholla-seed--689953a7,Seed,1500000,USD,1500000,2023-04-24,5,2,Empowering and rewarding shoppers in Africa’s emerging markets.,,"Amsterdam, Noord-Holland, The Netherlands, Europe",,https://maholla.com/,Maholla,https://www.crunchbase.com/organization/maholla,"Buffet Investments, Castleton Capital, GalloProvincialis, Mark Bowman, Praesidium Capital Management"
Seed Round - Amara Therapeutics,https://www.crunchbase.com/funding_round/amara-therapeutics-seed--1265d5e7,Seed,1500000,EUR,1649555,2023-05-08,2,2,Amara Therapeutics's is a digital therapeutic platform empowers women to take control of their pelvic health.,"Biotechnology, Health Care, Therapeutics","Galway, Galway, Ireland, Europe",,https://www.amaratherapeutics.com,Amara Therapeutics,https://www.crunchbase.com/organization/amara-therapeutics,"Enterprise Ireland, Western Development Commission"
Pre Seed Round - Novaheal,https://www.crunchbase.com/funding_round/novaheal-pre-seed--d3ccee5c,Pre-Seed,560000,EUR,619835,2023-05-03,11,3,Novaheal is a learning platform for trainees and young professionals in nursing.,"E-Learning, Nursing and Residential Care, Professional Services","Bochum, Nordrhein-Westfalen, Germany, Europe",,https://novaheal.de/,Novaheal,https://www.crunchbase.com/organization/novaheal,"9elements, allygatr, Bjorn Jopen, Detlef Friedrich, Johannes Rellecke, Julius Jürging, Marc Puškaric, Markus C. Mueller, Matthias Hofmann, Olav Sehlbach, Stephan Bals"
Pre Seed Round - Fari Analytics,https://www.crunchbase.com/funding_round/fari-analytics-pre-seed--723e7a55,Pre-Seed,500000,EUR,552275,2023-04-26,3,1,Fari Analytics democratises access to the possibilities of data analysis and AI.,"Analytics, Artificial Intelligence","Bordeaux, Aquitaine, France, Europe",,https://www.fari-analytics.com/,Fari Analytics,https://www.crunchbase.com/organization/fari-analytics,"Bpifrance, Finaqui, Thebault Thierry"
Seed Round - Secro,https://www.crunchbase.com/funding_round/secro-seed--866afc70,Seed,3600000,USD,3600000,2023-04-27,5,2,"Secro develops a supply chain platform to eliminate fraud, inefficiencies, and exploitation from global trade.","Business Development, Fraud Detection, SaaS, Supply Chain Management","Wilmington, Delaware, United States, North America",,https://secro.io/,Secro,https://www.crunchbase.com/organization/secro,"Augment Ventures, Grit Ventures, Gumption Ventures, Kluz Ventures, TMV"
